,Sentence,Author_name
751,but i have not made my mind  yet,Elena's story
752,"  a  n  o Rate This Reply   elenaphd soys: November 26, 2010 at 12:54 am  Hi, Ahmad! Sure, go for it! It's always useful to reflect on your experience, and you can also help  other international PhD students to better understand the PhD process, and adapt to an educational  system! I am sure it will be very interesting! Good luck, and give me a shout if you need any help",Elena's story
753,"  o  o  Rate This Reply   My PhD soys: November 28, 2010 at 1:46 pm  hi elenaphd, i just opened my micro blog at http://mynhd",Elena's story
754,com/ thanks for your  inspiration,Elena's story
755,"  o   o Rate This   elenaphd soys: December 3, 2010 at 5:26 pm  Hi, so glad for you! Look forward to your blog posts! Good luck! n  o  o rate This  Gul says: November 26, 2010 at 6:16 pm  hi elenaphd i am Gul llm student i am studying from university of london but i am his international  programm i am also interested in phD but in law subjects and want to get admission in uk do you  know any good universities where i could get an admission ?  o  o o rate This Reply  elenaphd says: November 26, 2010 at 6:47 pm  Hi, Gul! Glad to hear that you are going to do a PhD",Elena's story
756, It's the best learning experience that I've  ever had in my life,Elena's story
757, Not sure about Law schools but you can check some ranking here  http://www,Elena's story
758, Good luck!  o  o < Rate This Reply,Elena's story
759,"     Jeffrey Keefer says: December 31, 2010 at 3:12 am  Just stumbled across your work, and can relate in many ways to your sentiments",Elena's story
760, Great that you are  sharing this,Elena's story
761," Alas, if you regret all this after only one year, then perhaps you are too hard on  yourself!  So, with all this said, what is this topic about which you are so passionate, and what theory are  you hoping to use?  Jeffrey  o  o o Rate This Reply     elenaphd soys: January 21, 2011 at 1:38 pm  Hi, Jeffrey! So sorry, just realised that I still have note replied to you",Elena's story
762, Thanks a lot for your comments,Elena's story
763, In  my research I am looking at the process of developing employability skills by doctoral researchers  in social sciences,Elena's story
764, There is a lot of attention being paid to the formal approach in this area so I  am tryint to look more deeply into non-formal and workplaces learning activities that PhD students  are involved in which I believe have a greater impact on development of employability skills,Elena's story
765, I am  using various learning theories,Elena's story
766, The central theoretical framework for my study is an Activity  theory,Elena's story
767," How about you? What does your research focus on?  o & o > Rate This Reply   Jeffrey Keefer says: January 23, 2011 at 1:51 pm  What an interesting area of study!  When you speak of “developing employability skills by doctoral researchers in social sciences” are  you referring to research-focused degrees, or professional doctorates?  Jeffrey  o  o < Rate This Rep_jy    elenaphd says: January 27, 2011 at 1:44 pm  I am looking at full-time PhD students enrolled on traditional PhD programmes (3 years, full-time  research)",Elena's story
768,  o  o > Rate This Reply,Elena's story
769,"    Mahesh Sharma says: March 21, 2011 at 8:39 am  your story is so inspiring for research scholars like me",Elena's story
770, i am even a slower learner,Elena's story
771, My writing  skills are very poor,Elena's story
772, can u help me out mentioning some names of the books which i should consult  to improve my writing skills  o  o < Rate This Reply,Elena's story
773,"   elenaphd soys: May 18, 2011 at 1:02 am  Dear Mahesh! So sorry for delay",Elena's story
774, Writing skills are smth that you master all life I guess,Elena's story
775, Are you  using Delicious bookmarking,Elena's story
776, Here is a link to my collection of bookmarks on academic writing httn-//www delicious com/elena,Elena's story
777," Hope you will find smth useful there! Good  luck with your PhD!  o  o < Rate This     Zed says: May 3, 2011 at 3:43 pm  I'm in my first year",Elena's story
778, Your reflections contain some good advice,Elena's story
779, Seven months in and feeling really  lost at the moment,Elena's story
780,"  o  o o rate This Reply   elenaphd says: May 18, 2011 at 1:00 am  Dear Zed! Sorry for delay! Feeling lost",Elena's story
781, No worries,Elena's story
782,you are not alone! Are you  on Twitter at all? there are some interesting discussions going on there every Wed at 7,Elena's story
783,3o at  #phdchat,Elena's story
784, Lots of useful advice and peer support,Elena's story
785, Join in! And chin up! Take is as a learning  experience whatever happens on your PhD journey!Good luck!  o  o < Rate This Reply,Elena's story
786,"     Adrian says: June 9, 2011 at 10:27 pm  Hi, Thanks GOD, I got something at least to define my current state",Elena's story
787," You right, its my 4th month of PhD  and I was in a situation like “What the hell going on :P” ",Elena's story
788, In fact assuming my previous knowledge  is just multiple with zero,Elena's story
789," Now after reading your article, again my energy level is up",Elena's story
790,"  *1-2 years PhD students, please do share your experience ",Elena's story
791,  Cheers  o  o o Rate This     theshanshuprophecy,Elena's story
792," soys: January 15, 2012 at 1:00 pm  Hi I stumbled onto your blog tonight after a google search and just wanted to say that you list is  great but — perhaps you should consider thinking of it as ‘things I learned in my 1st year’ rather  than regret — although you are a year further in now, I would love to hear your list from and year  or, are you no longer posting?  o  o < Rate This Reply",Elena's story
793,"    nagulmeera says: February 18, 2012 at 7:52 pm  HI my name is nagu1",Elena's story
794,"i need a statement of purpose for my phd in information systems,i have  completed my MCA in (you)",Elena's story
795, i dnt know how to wright the this letter will you plz help me for  this,Elena's story
796,"after submitting this sop 1etter,they will decide and sent a mail about my admission",Elena's story
797,is it  compulsory a student(fresher)must have a subject know1edge?or not,Elena's story
798,p1z guys reply for this  query,Elena's story
799,even i dnt have that much of knowledge about my subjects but my aim is to do phd,Elena's story
800,if there is  any chance to learn in phd deeply about my subjects,Elena's story
801,my area of interest in databases,Elena's story
802,"  i  o  Rate This Reply    BeingmrsdrD says: March 10, 2012 at 9:50 pm  So glad I found your blog! I'm also on the PhD journey (and blog about it) and relate to many of  the points you raised here",Elena's story
803," All the best with your studies  o  o o rate This   Clement soys: July 12, 2012 at 5:42 pm  any tips on how to narrow your research topic down? I'm really struggling with defining my thesis  at the moment, and I'm approaching the end of the first year",Elena's story
804," Thanks  o  o < Rate This Reply    ahmed says: July 24, 2012 at 4:21 pm  please i need help how to do plan for the first year PhD in engineering  o  o o rate This Reply    Vicky says: November 7, 2012 at 12:06 am  Tell us about your transfer viva? Highs Lows Hints & Tips would really help",Elena's story
805," I've got mine next  week!  o  o o Rate This   elenanhd soys: November 12, 2012 at 11:05 am  Hi, Vicky! Sorry for delay, having a mad time trying to finish my thesis",Elena's story
806, I actually did not have a  transfer viva but I had a transfer report,Elena's story
807, Basically an extended research proposal that reflected  all the staged of my thesis writing,Elena's story
808, I submitted it after one year when I had a clearer idea of the  thesis content and structure,Elena's story
809, Hope the viva went well   o  o < Rate This Reply     My exciting PhD journey!  Blog ct WordPress,Elena's story
810,"Maria: Hello PO, and welcome to the PhD Career Stories podcast! PO: Hi and thanks for having me",Per-Olof-Arnäs
811, Maria: I'm very happy to have you here,Per-Olof-Arnäs
812, Let's start with you telling us a bit more about yourself,Per-Olof-Arnäs
813," Who are you and what do you do? PO: My name is Per Olof Arns, which is difficult name for non-English and non-Swedish speakers",Per-Olof-Arnäs
814," I am a doctor in logistics, and right now I'm a senior lecturer at Chalmers University of Technology in Gothenburg in Sweden where I teach and research in the digitalization of the freight transport industry",Per-Olof-Arnäs
815, Because I love the twenty first century so this is quite a nice job actually for me,Per-Olof-Arnäs
816, But I've been doing a lot of other things as well,Per-Olof-Arnäs
817," My path - my PhD career path - has been a bit bumpy, and it has taken some other turns",Per-Olof-Arnäs
818, Now I see that it's a quite unique path,Per-Olof-Arnäs
819, Maria: It usually is,Per-Olof-Arnäs
820, But I'm curious why did you decide to pursue a PhD in the first place? Was it always an obvious choice for you? PO: Partly is because I tend to agree to things I don't really understand,Per-Olof-Arnäs
821, Like starting a podcast or doing a PhD,Per-Olof-Arnäs
822, I was a student in mechanical engineering in the 1990s,Per-Olof-Arnäs
823," I took my degree in 1996, but mechanical engineering was not really my thing",Per-Olof-Arnäs
824, I just ended up there because I sort of crossed that program when I applied and that's where I ended up,Per-Olof-Arnäs
825," But during the third year of this five year education, I got the first taste of logistics, and I really found that interesting, and challenging, and that I was really good at it as well",Per-Olof-Arnäs
826," I started taking all of those courses, and when a PhD position opened in 1996 I applied for it",Per-Olof-Arnäs
827," No, actually, it was quite a conscious decision from my part",Per-Olof-Arnäs
828," The last year - to get into the department - I, actually did some extra teaching for them",Per-Olof-Arnäs
829," I worked extras as lab assistant and things like that, because I knew that I would like to do a PhD there",Per-Olof-Arnäs
830, When they open up a position and I applied for it and I got it,Per-Olof-Arnäs
831," Then I started doing my PhD, and I had no idea what it meant",Per-Olof-Arnäs
832, Maria: That is actually another question from me,Per-Olof-Arnäs
833, Is is there anything - now that you're looking back - that you wish you had known before you started to do your PhD? PO: Yes,Per-Olof-Arnäs
834, The importance of publications,Per-Olof-Arnäs
835, That was not important in the 1990s,Per-Olof-Arnäs
836," It was not really encouraged to write journal papers for us in our discipline, which ended up being a monograph instead of collection of papers, which was extremely difficult to write",Per-Olof-Arnäs
837," You have to write a book instead of writing papers, so most of the work is actually done it at the end instead of during the project",Per-Olof-Arnäs
838," If I had to do it all over again, I would have done a collection of papers and I would have aimed for the right journals and the right topics as steps on the path towards a PhD",Per-Olof-Arnäs
839," But that was the 1990s, nothing was the same then as it is now",Per-Olof-Arnäs
840, It's much much more different now,Per-Olof-Arnäs
841," Maria: If I understand correctly: after your PhD, you decided to leave academia",Per-Olof-Arnäs
842," PO: Actually, before",Per-Olof-Arnäs
843, Maria: Before - to take a job in the industry,Per-Olof-Arnäs
844," PO: In 1999, I did my license",Per-Olof-Arnäs
845," We have this intermediary degrees in Sweden, which is sort of halfway through the PhD process",Per-Olof-Arnäs
846," But, I would like to say it's 25 percent of the work, then 75 percent of the work on the content comes after that",Per-Olof-Arnäs
847," A lot of courses, saying that you're trained to craft the research - that's what you sort of doing the license for - that you can perform a study, you can do interviews and things like that",Per-Olof-Arnäs
848, And then I started on on my PhD project and I sort of shifted,Per-Olof-Arnäs
849," I started out working on dangerous goods, logistics effects of dangerous goods",Per-Olof-Arnäs
850," But then I started looking more into heterogeneous codes, more broadening the perspectives",Per-Olof-Arnäs
851," Then I also started a consultancy on the side, writing computer programs for the transportation industry, and that's when I came across object-oriented programming, which was a completely different topic from logistics",Per-Olof-Arnäs
852," I was wondering why it was so, because it was really useful - the modeling tools in the object-oriented programming world was really applicable in logistics, but no one had done it",Per-Olof-Arnäs
853, So I switched gears and started looking into object oriented modeling of transportation systems as a tool to understand them better,Per-Olof-Arnäs
854," Some people had done it but that was like five or six papers, some consultancy work, but it was quite an open field",Per-Olof-Arnäs
855," So I started looking into that, and I was almost finished - I was taking a bit longer",Per-Olof-Arnäs
856, Lots of the PhD students in my department was taking a bit more time than they actually should,Per-Olof-Arnäs
857," I was in 2002, which was then my sixth year",Per-Olof-Arnäs
858," We have this final seminar, which is supposed to be two months before PhD thesis is finished, where you have an external opponents, and all your colleagues",Per-Olof-Arnäs
859," The informal name for this is the""Pie throwing"" - where everyone tries to bring your thesis down as much as possible, so that you would have that feedback before your defense",Per-Olof-Arnäs
860, It's a sort of a dry run,Per-Olof-Arnäs
861, And after that the opponent and you write the report each and say this needs to be done and this is time plan,Per-Olof-Arnäs
862," Everyone signs off, and then you do the work, and a few months later you can publish your thesis",Per-Olof-Arnäs
863, I had this event in 2002 in December and in January I left the university,Per-Olof-Arnäs
864," Because I had this two months left of work ahead and I had a plan to do it, but I got the job offer from the industry",Per-Olof-Arnäs
865," I started working for the haulage industry in Sweden, in an R&D-based organization - those that once I've done consultancy work for",Per-Olof-Arnäs
866," So I started programming, and started educating, and I started doing a lot of things in the industry",Per-Olof-Arnäs
867," I had really a good time, and I made more money than I did as a PhD student, and all of a sudden it was 2006",Per-Olof-Arnäs
868," My employer asked me: ""Well, we hired a doctor - where is he?""",Per-Olof-Arnäs
869, And I actually had not stopped - I've been keeping the thesis afloat,Per-Olof-Arnäs
870," It was a monograph, so no papers",Per-Olof-Arnäs
871, It was just that things needed to fall into place,Per-Olof-Arnäs
872," Then in 2006, I said to my employer: ""I need two months",Per-Olof-Arnäs
873,""" So they say: ""Okay, get two months, when don't have to do anything else",Per-Olof-Arnäs
874,""" So they were actually funding my PhD thesis",Per-Olof-Arnäs
875, I got December and January 2006-2007 and finished the thesis,Per-Olof-Arnäs
876," It took two months, and I defended it in 2007 - eleven years after I started",Per-Olof-Arnäs
877," Maria: But I'm really impressed, because you decided to do it -- and you did it",Per-Olof-Arnäs
878, PO: It was then or never,Per-Olof-Arnäs
879, Because I was quite comfortable in the industry,Per-Olof-Arnäs
880," And then I worked at that organization for a number of years, and I started to work together with the university",Per-Olof-Arnäs
881," Instead of being a PhD student, I now started projects together with them",Per-Olof-Arnäs
882," We hired a PhD student, we started looking into different areas",Per-Olof-Arnäs
883, Maria: Did you maybe get funding as well? PO: I applied for funding together with the university for one PhD student in a project that was mutually published between us,Per-Olof-Arnäs
884," I kept the relationships - I went there for coffee, we had a lot of fee where we sit and drink a lot of coffee in the afternoon, everybody loves it, and that's where you meet all the nice people",Per-Olof-Arnäs
885, I kept the relationships and in 2011 I went back,Per-Olof-Arnäs
886," They had an open spot as a senior lecturer, and I applied for it and I got it",Per-Olof-Arnäs
887," So since then I'm back at Chalmers, doing a lot of different things",Per-Olof-Arnäs
888," But those eight years that I had an industry are priceless for me, because I'm very much unique in that manner",Per-Olof-Arnäs
889," I've been in academia, then I've been in industry, and then I'm going back to academia with the network and with the knowledge",Per-Olof-Arnäs
890, And you cannot learn that in the book - you have to do it,Per-Olof-Arnäs
891," Maria: Looking back when you had your PhD and, of course, you were already consulting, and then you started working with that company even more: what kind of skills did you bring from academia to that company that they found really useful? PO: Teaching",Per-Olof-Arnäs
892," Maria: Teaching?! PO: Yes, I was already doing a lot of teaching",Per-Olof-Arnäs
893, At Chalmers a lot of students teach,Per-Olof-Arnäs
894," We gave lectures even, not only supervisions and things like that",Per-Olof-Arnäs
895," Back then, at least",Per-Olof-Arnäs
896," Now, it's more or less just the lecturers and the professor who give lectures",Per-Olof-Arnäs
897, PhD students did a lot of the teaching,Per-Olof-Arnäs
898, I had experience in teaching and my main skill sets is to whip up the PowerPoint presentation in 5 minutes - that will blow everyone's mind,Per-Olof-Arnäs
899, I did a lot of teaching when I was in industry,Per-Olof-Arnäs
900, We had a lot of haulage companies that needed education in environmental transportation,Per-Olof-Arnäs
901, I did all of those,Per-Olof-Arnäs
902, Maria: Was that something that you knew that you were going to do? PO: Yes,Per-Olof-Arnäs
903, And then I brought with me contacts also,Per-Olof-Arnäs
904," I also brought with me a vocabulary: I could talk to universities, I could talk to other researchers, and I could understand them, and they could understand me",Per-Olof-Arnäs
905," I knew the codified language, so to speak",Per-Olof-Arnäs
906, That was a real asset in building relationships,Per-Olof-Arnäs
907," Maria: And then going back to academia: What did you bring back from the industry? PO: Some efficiency, I think, which I'm struggling with now I am in a large organisation which is extremely bureaucratic",Per-Olof-Arnäs
908," We were two people in my previous organisation, so we outsourced some things",Per-Olof-Arnäs
909," Now I have to fill out forms, I have to scan receipts, do all of these things",Per-Olof-Arnäs
910, There are policies and rules and regulations for everything,Per-Olof-Arnäs
911," Of course, this keeps a lot of people employed, which is sort of a good thing, but it keeps me from doing what I really want",Per-Olof-Arnäs
912, That can be really frustrating,Per-Olof-Arnäs
913," Not only for me,who had been in industry, I think, it frustrates a lot of people -- the bureaucracy of universities",Per-Olof-Arnäs
914," Maria: Are there any other differences that you can see between academia and industry? PO: Of course, in industry you have you have your money",Per-Olof-Arnäs
915, In universities you have tax money,Per-Olof-Arnäs
916," And it is a different way of looking at what you spend, how you spend, and so on",Per-Olof-Arnäs
917, So there are differences in culture in industry and academia,Per-Olof-Arnäs
918," Maria: How does that express itself, do you think? PO: You can see it here in Almedalen, where we are now, where there is a lot of public money spent during this week",Per-Olof-Arnäs
919," And industry is also spending money, but they are doing it differently",Per-Olof-Arnäs
920," They are doing it more targeted, not that broad like the public organisations",Per-Olof-Arnäs
921," Maria: They are expecting outcomes? PO: Yes, they are a result-oriented",Per-Olof-Arnäs
922, Which I I think is a good thing,Per-Olof-Arnäs
923," I haven't done my last tour in industry, I want to go back someday, yes",Per-Olof-Arnäs
924," Maria: But looking back; what was kind of the biggest career decision for you? Was it to leave, or to go back? PO: I think all of these decisions have been, in retrospect, big decisions",Per-Olof-Arnäs
925," To do the PhD; I have my friends, they have done completely different careers, in industry",Per-Olof-Arnäs
926," Good careers, many of them",Per-Olof-Arnäs
927, There was one big decision,Per-Olof-Arnäs
928," In one way, my thesis became much, much better, being marinated for a number of years",Per-Olof-Arnäs
929, So I'm really proud of my PhD thesis,Per-Olof-Arnäs
930, It would not have been that good if I had done it in 2003,Per-Olof-Arnäs
931," But on the other hand, it would have passed and I would have been approved and would have been a doctor",Per-Olof-Arnäs
932, But then I think I would have left for industry actually,Per-Olof-Arnäs
933, Maria: Yeah you may not have come back,Per-Olof-Arnäs
934, PO: No,Per-Olof-Arnäs
935, Maria: ,Per-Olof-Arnäs
936, to academia,Per-Olof-Arnäs
937, PO: No,Per-Olof-Arnäs
938, I would have left for industry and I would have stayed in industry,Per-Olof-Arnäs
939," So because I had my, sort of, two months left, I kept in touch with the University",Per-Olof-Arnäs
940, Maria: That is really interesting,Per-Olof-Arnäs
941," So Tina Persson, the founder of this podcast, she often talks about transferable skills",Per-Olof-Arnäs
942, That is how PhD students can learn a lot of skills during their PhD and find out later in life that they can apply these skills to a totally different field,Per-Olof-Arnäs
943, What are your thoughts about that? PO: Yes,Per-Olof-Arnäs
944, Several of those skills of course,Per-Olof-Arnäs
945," Presentation skills, which is crucial for a researcher to be able to present your work",Per-Olof-Arnäs
946," But also to briefly summarize something, to make sense of a complex issue",Per-Olof-Arnäs
947, Maria: ,Per-Olof-Arnäs
948,to penetrate a lot of data,Per-Olof-Arnäs
949," PO: Yeah, penetrate data and to avoid oversimplifications",Per-Olof-Arnäs
950," To be able to discuss and problematize the topic, not to oversimplify it, and and to really take a systems perspective",Per-Olof-Arnäs
951," At least for me, because I am in a discipline where we always need to take a systems perspective",Per-Olof-Arnäs
952," Which means that it is actually more important to the define the system boundary, then to define the system itself",Per-Olof-Arnäs
953," You have to know what you exclude and include, because it will determine the results",Per-Olof-Arnäs
954," I think that is a very good thing to have with you in industry, because in industry you very soon will get extremely locked in a bubble",Per-Olof-Arnäs
955," Of your own company, or your own division, or your own organization, or your own customers",Per-Olof-Arnäs
956, And it's very hard to look outside to see parallel organizations outside; what they are doing and how we can learn from them,Per-Olof-Arnäs
957," So, I give a lot of talks in industry",Per-Olof-Arnäs
958," And one thing I always end with, is to say that once every week they have to watch TED Talk",Per-Olof-Arnäs
959, And once every year they have to attend a conference which is totally outside their own field,Per-Olof-Arnäs
960," Like Almedalen, that it is a good one or TEDx, or something like that",Per-Olof-Arnäs
961," Because otherwise their brains will sort of stop evolving, I think",Per-Olof-Arnäs
962," Maria: This lifelong learning that we need to think about, everyone",Per-Olof-Arnäs
963, PO: Yes,Per-Olof-Arnäs
964," And it is easier than ever, to do that",Per-Olof-Arnäs
965, Maria: Yes,Per-Olof-Arnäs
966," Other skills, do you think? PO: For me personally, I have done a MOOC:s I have done a lot of blended learning",Per-Olof-Arnäs
967, I am very passionate about teaching and developing new teaching methods,Per-Olof-Arnäs
968," So I I have evolved myself on my own initiative in the university's development; blended learning, digital examination and things like that",Per-Olof-Arnäs
969," So I now have positions in several committees, and things like that, at university, because I am passionate about it",Per-Olof-Arnäs
970," And I think that that is also something that is needed in the industry, pedagogical professionalism",Per-Olof-Arnäs
971," Maria: That is really, really cool",Per-Olof-Arnäs
972," Now, as I mentioned earlier, you are also a fellow podcaster",Per-Olof-Arnäs
973," Would you like to tell us a bit more about these shows that you produce? PO: Yes it is podcasts in plural! I have to two, and almost three",Per-Olof-Arnäs
974," I have one in Sweden called Logistikpodden, The Logistics Podcast, in Swedish",Per-Olof-Arnäs
975," And I'm doing it on my own money and on my own time, but it is connected to my area of expertise, which means that most of our interviews, I actually do in my office, on campus",Per-Olof-Arnäs
976, And several of these interviews,Per-Olof-Arnäs
977," I meet the celebrities in the logistics industry, or they should be celebrities at least",Per-Olof-Arnäs
978," And several of these have led to deeper contacts, and even research projects",Per-Olof-Arnäs
979, So there is a synergy between what I do in my podcast and what I do at work,Per-Olof-Arnäs
980, So that is one of them,Per-Olof-Arnäs
