,Sentence,Author_name
1220,"  During the spring I build a small conference management system using Jeeves, not because I want to but because Armando says it is important to build things to see what breaks",Jean-Yang
1221, This takes a lot out of me because Jeeves doesn't really work yet and I previously knew little about building web applications,Jean-Yang
1222, We run out of memory all the time and I have to wake up in the middle of the night to restart the server,Jean-Yang
1223," For weeks after, my friends make fun of me by sending emails telling me my server is down",Jean-Yang
1224," For weeks, Armando and I wake up with nightmares in the middle of the night that our server is down",Jean-Yang
1225," During this process I also realize that in order for language-based solutions to work, we have to have a better story with interfacing with the database",Jean-Yang
1226, I feel proud that I convince Armando this is an important direction of future work,Jean-Yang
1227, I also concede that it is important to build things,Jean-Yang
1228,  This spring I do some traveling,Jean-Yang
1229," I win a Facebook Fellowship and travel to the Bay Area to give talks at Facebook, Google, and Berkeley",Jean-Yang
1230, I attend another workshop at Dagstuhl and spend the weekend in Paris beforehand and meet my friend Kate in Barcelona after,Jean-Yang
1231,  My social life becomes fantastic this year,Jean-Yang
1232," I find the ""party circuit"" orbiting a nucleus of social Harvard and MIT graduate students",Jean-Yang
1233, I meet many interesting and brilliant people,Jean-Yang
1234,  Summer 2012,Jean-Yang
1235," I intern at Facebook to gain ""privacy street cred",Jean-Yang
1236,""" I start in July because it's after the POPL deadline",Jean-Yang
1237, The other interns starting at the same time are all Eastern European college boys,Jean-Yang
1238, This becomes my friend group for the summer,Jean-Yang
1239," I live in the city and commute to Menlo Park every day, staying on campus for 10-12 hours",Jean-Yang
1240," I work hard, building a verifier for privacy policies using Haskell",Jean-Yang
1241, I like the work but find it isolating because I'm the only person working on my project and it's not clear what I am allowed to talk about outside of work,Jean-Yang
1242," I take daily walks with my friend Pieter Hooimeijer, who I knew from research and went to Facebook after his PhD",Jean-Yang
1243," I work harder than I want to because of the potential high impact of this project: it is tied to a pre-launch project and if it launches well, this could be a really nice example of verification in production use at a large company",Jean-Yang
1244, Armando flies out to Facebook at the end of the summer to discuss my project under NDA,Jean-Yang
1245, I am so happy to see him,Jean-Yang
1246,  2012-2013 (Year Five),Jean-Yang
1247, I return to school but continue contracting for Facebook,Jean-Yang
1248, I work on my verifier one day a week and fly out to the Bay Area every few weeks for a few days at a time to continue working on my project,Jean-Yang
1249," I maintain two social lives, one in Cambridge and one in San Francisco",Jean-Yang
1250," The bigger project I'm a part of gets cancelled around February, for political and not technical reasons",Jean-Yang
1251," I feel very disappointed, especially because my verifier had been very close to being put into production",Jean-Yang
1252," I also feel relieved, because I'm exhausted from having two jobs and two social lives",Jean-Yang
1253," I make some small efforts to try to publish on what I built, but Armando is not excited and the team at Facebook has scattered",Jean-Yang
1254, We file a patent,Jean-Yang
1255,  The rest of my research is not satisfying this whole year,Jean-Yang
1256," I work on extensions to Jeeves that Armando tells me are necessary for the work, but that I am not excited about",Jean-Yang
1257, We work on integrity extensions to Jeeves that I don't think make sense,Jean-Yang
1258," What I really want to do is figure out how to extend the Jeeves programming model to the database, but I can't work on this until after we finish this other stuff",Jean-Yang
1259, I submit an uninspired paper to CAV,Jean-Yang
1260," One of the reviews says, ""I cannot believe there are four authors on this paper and so many typos",Jean-Yang
1261,""" I am not excited about anything by the end of this year",Jean-Yang
1262,"  In the spring, I take a class in the Media Lab with Ethan Zuckerman about new media",Jean-Yang
1263, Half the students are technologists and half are mid-career journalists at Harvard and MIT on various fellowships,Jean-Yang
1264," This gets me thinking much more about media, online communication, and civic participation",Jean-Yang
1265,  Summer 2013,Jean-Yang
1266," I stay around school to work on the integrity story for Jeeves, which I continue to not believe in",Jean-Yang
1267, Armando tells me it is time for me to graduate and go on the academic job market,Jean-Yang
1268, I tell him the academic job market is a big commitment because 1) I don't know that working alone forever is the best way to achieve the things I want to achieve and 2) the work/life balance doesn't seem great,Jean-Yang
1269," He says 1) is a result of how he chose to run his group, but if I don't want to put in the work of being a professor then I should wrap up my work as quickly as possible and move on with my life",Jean-Yang
1270, We are both sad,Jean-Yang
1271,  2013-2014 (Year Six),Jean-Yang
1272," I spend a month having in-person and Skype meetings with people about other career paths, for instance working at LogicBlox or Jane Street Capital",Jean-Yang
1273," After my mother reminds me I don't have to do computer science anymore, I consider becoming a writer or an artisan specializing in linocut block prints",Jean-Yang
1274," Rocky, who works on my floor, tells me that usually everyone on the seventh floor can hear when I laugh, but he has not heard me laugh for six months",Jean-Yang
1275,"  During this time, I also visit Andrey Rybalchenko and Byron Cook at Microsoft Research Cambridge",Jean-Yang
1276, I enjoy myself immensely and have many stimulating meetings and become exposed to the field of executable biology,Jean-Yang
1277, (Later I find out this was a secret interview,Jean-Yang
1278,) I determine that nothing else is as exciting to me and even though academia is a big commitment it seems worth it,Jean-Yang
1279, I tell Armando I'm ready to go on the job market and he says he already told everyone I wasn't anymore and plus it's better for me to wait,Jean-Yang
1280," I am more than fine with this, since a big issue had been that I don't want to leave yet",Jean-Yang
1281,"  After I determine that one of my main issues with my project is that nobody uses Scala for prototyping web apps, I decide to switch to Python",Jean-Yang
1282, Armando lets me take on an MEng (masters) student to convert our implementation to Python,Jean-Yang
1283, I find Travis Hance,Jean-Yang
1284, He finishes the conversion in the fall and we spend all spring collaborating on building a web framework based on Jeeves,Jean-Yang
1285," I am really excited to finally be thinking about the problem of extending the programming model to the database, especially as this is something I had wanted to do for two years",Jean-Yang
1286, I love having Travis as a collaborator,Jean-Yang
1287, We decide to submit to OSDI,Jean-Yang
1288," During the weeks before OSDI, we work together for 10-12 hours a day",Jean-Yang
1289, I introduce him to many Kendall Square restaurants,Jean-Yang
1290," During our breaks, we create Haskell Ryan Gosling",Jean-Yang
1291,  During this time I also decide to take my interest in writing more seriously,Jean-Yang
1292," The previous year I had come across a former problem set partner Carl Schoonover on Business Insider's list of sexiest scientists in the world and discovered he had been achieving my science writing dreams: writing a book, speaking about science, and even starting a group called NeuWrite to promote collaborations between scientists and science writers",Jean-Yang
1293," I had brought him to MIT to speak, which led to two things: 1) me assembling an RSVP list of Harvard and MIT graduate students interested in science writing and 2) Carl deciding I was a good person to take over the NeuWrite Boston group, as group membership was shrinking and the current leaders were moving away",Jean-Yang
1294, One of the journalists from my new media class introduces me to science writer Amanda Gefter and we take over the group,Jean-Yang
1295, We build a new group from the event RSVP list and Amanda's writer friends,Jean-Yang
1296," I spend much of my free time 2014-2015 building the group, thinking about writing, and writing",Jean-Yang
1297, I start publishing not only on my own blogs but also in more public venues,Jean-Yang
1298, A couple of my Quora answers get published on Forbes and my pieces for The Muse get chosen to run in Forbes and Newsweek,Jean-Yang
1299,  Summer 2014,Jean-Yang
1300, PLDI is in Edinburgh at the beginning of June and my friend is getting married in Croatia at the end of June,Jean-Yang
1301," Since Armando is paying for the trans-Atlantic flights, I scheme to remain in Europe for the month",Jean-Yang
1302," I set up another visit to Microsoft Research Cambridge and a visit to the Max Planck Institute in Kaiserslautern, Germany",Jean-Yang
1303, I get good feedback on my work during both visits,Jean-Yang
1304, I then spend a long weekend in Berlin visiting my friend Kate and a week wandering around various parts of Croatia for vacation purposes,Jean-Yang
1305, I see Oslo for a day on the way back,Jean-Yang
1306, I find the entire trip relaxing but find it difficult to return to normal life after,Jean-Yang
1307,"  Our OSDI submission gets rejected, so I spend the rest of the summer cleaning up the paper and doing more work to submit to PLDI",Jean-Yang
1308, I feel an incredible amount of angst about my uncertain future as I prepare for the job market,Jean-Yang
1309," I spend one day a week doing extreme exercise, cycling 50+ miles or running 11+ miles, to obliterate all thoughts",Jean-Yang
1310, For various reasons I also spend a lot of weekends in New York and make more friends with people working on data and journalism,Jean-Yang
1311,  2014-2015 (Year Seven),Jean-Yang
1312, I spend most of the fall preparing a submission about the Jeeves-based web framework to PLDI,Jean-Yang
1313, I also work on my job applications,Jean-Yang
1314," I go on the job market, interview, etc",Jean-Yang
1315," I get some offers, accept a position at Carnegie Mellon University, and defer a year to collect myself before beginning and also to explore my interest in applying programming languages and biological modeling",Jean-Yang
1316,"  To keep myself from thinking about my uncertain future all the time, I start a cybersecurity accelerator, Cybersecurity Factory, with my friend Frank Wang, with the goal of helping research-minded people start companies",Jean-Yang
1317, After Frank and I ran out of research things to talk about the natural next step was to develop a project of mutual interest and we're both interested pushing academic research into the world,Jean-Yang
1318,  I don't have much of a social life this year,Jean-Yang
1319, For a couple of my interviews I stay with friends beforehand and they listen to my talks,Jean-Yang
1320, My friends Alison and Tobi make sure to force me out of my house for non-work reasons every once in a while,Jean-Yang
1321, Every few weeks my friend Angela comes over and cooks me dinner,Jean-Yang
1322, I remain grateful for my friends,Jean-Yang
1323,  Summer 2015,Jean-Yang
1324," I spend the first part of the summer working on writing up the Jeeves-based web framework work, which has continued to be rejected from every conference",Jean-Yang
1325, I get the framework to be much faster and work with my collaborators on a cleaner semantics,Jean-Yang
1326, We submit to POPL and then I work on my thesis,Jean-Yang
1327," The introduction and related work take much longer than expected, maybe about a month",Jean-Yang
1328,  During this time I spend maybe about a third of my time working on the accelerator and doing public communication about cybersecurity,Jean-Yang
1329, We accepted two teams for our Cybersecurity Factory pilot program and we work closely with them to make sure they are getting the support they need,Jean-Yang
1330, I spend a good amount of time on the phone with media people getting press for our program,Jean-Yang
1331, I write an op-ed for the MIT Tech Review,Jean-Yang
1332,  Somewhere in there I take a 36-hour trip to Singapore to give a talk at a data privacy workshop Saman is organizing,Jean-Yang
1333, Saman gets the people to fly me business class so I can sleep in transit,Jean-Yang
1334, It is my first time flying business class,Jean-Yang
1335, I am confused about what to do with such frequent deliveries of hot towels to my seat,Jean-Yang
1336,  I don't have much of a social life during this time either,Jean-Yang
1337," Several people text me ""you have to eat sometime"" after I repeatedly decline meal invitations",Jean-Yang
1338,  2015-2016,Jean-Yang
1339, I defend! I take two weeks off and then start a postdoc at Harvard Medical School,Jean-Yang
1340, I slowly ease myself back into having hobbies and seeing friends,Jean-Yang
1341, Our POPL submission gets rejected and I finally spend a lot of time thinking about how to sell the work (rather than how to do the work),Jean-Yang
1342," I learn that despite pressures to make the work better until the last minute, I need to fight to spend a long time on the writing, especially if the proposed idea is outside of the mainstream",Jean-Yang
1343, A nice story emerges about a new and practical web programming model that allows programmers to factor out information flow policies across the multiple runtimes of the application and database,Jean-Yang
1344, Our paper finally gets accepted at PLDI,Jean-Yang
1345, I feel relieved to publish the final part of my thesis,Jean-Yang
1346, And here we are now,Jean-Yang
1347,"  For those wondering what to take away, it is important to note that every PhD experience is unique influenced by factors such as the advisor relationship, institutional requirements, the funding situation (both professional and personal), and the academic and social environments",Jean-Yang
1348, I am privileged to have had a relatively supportive environment and few additional pressures,Jean-Yang
1349," My experience is most likely to generalize for other computer science PhD students at top schools, where the funding situation tends to be good and advisors tend to give students a fair amount of freedom",Jean-Yang
1350,■ BMC _(http:    biomedcentral com )  Blog Network(j)  Research in gress OO   (//twitter com/BioMedCentral)  (https://blogs,Jillian's story
1351,com/bmcblog/) About this bIog_(https: blogs,Jillian's story
1352,"com/bmcbIog/about)    Starting your PhD and finding your feet  At the beginning of a new chapter in your life, starting a PhD can be daunting",Jillian's story
1353," You've got your  undergraduate degree, and maybe even a Masters, but how does this step up differ? Find out more and  get some great advice from someone who's been there",Jillian's story
1354,  Jillian Hart (https:  blogs,Jillian's story
1355,"com/bmcbIog/author/jillianhart) 2 Oct 2015                      It can seem stressful and demanding, but remember to enjoy your time as a PhD student Flickr/Tommy Ellis  So you're starting a PhD",Jillian's story
1356," You feel nervous, lost, confused and worried",Jillian's story
1357," The majority of PhD  students will already have an undergraduate degree and a Masters degree, therefore you could be  forgiven for failing to see why anyone would feel nervous going onto yet another degree",Jillian's story
1358,  But anyone who is doing or has completed a PhD will know that embarking on Doctoral research is  quite a different journey to an Undergraduate or Masters,Jillian's story
1359," Undergraduate and Masters programs often  have large bodies of other students on the course, for the most part completing the same class  based exercises and modules",Jillian's story
1360,"  Whereas, with the PhD, for at least the next three years you're the only one on the planet doing  this specific research (at least you hope — the original contribution race is a blog for another  day)",Jillian's story
1361,  The PhD journey  Every PhD journey is slightly different,Jillian's story
1362," Your journey will be constructed not only by your  research, but by your supervisory team, your peers, your institution, your working pattern, and so  on",Jillian's story
1363,  This independent journey is known to be one of the reasons why a PhD can often be somewhat  challenging and isolating,Jillian's story
1364," However, a PhD would not be the 'gold standard' of education if it was  stress-free, undemanding and straightforward",Jillian's story
1365, Who wants an easy life? Certainly not anyone in  academia!  As a PhD student (especially at the beginning) you feel confused and worried that everyone else  seems to know what they're doing and you don't,Jillian's story
1366, Fret not! This is normal and is likely the same thing your peers are thinking  too,Jillian's story
1367,"   Talk to fellow students  Speak to other PhD'ers, speak to others who have completed their PhD",Jillian's story
1368, You'll likely find that they  had similar anxieties and fears,Jillian's story
1369," The beginning of your PhD and finding your feet will be tough  enough, so don't carry even more weight on your shoulders than you have to by feeling worried that  you're not good enough or that you don't have a clue what you want from your research, what it  means, how you will carry it out, or produce a thesis so huge that it reminds of you of James and  the Giant Peach",Jillian's story
1370,"  I recently spoke to a third year PhD student, in the write-up stage, with only 12 weeks to go  before submitting the thesis",Jillian's story
1371, They told me that even now they still have periods of perplexity  while writing up,Jillian's story
1372,"  A fear that the work is simply not good enough, despite supervisors and peers telling them how well  they are doing",Jillian's story
1373, As academics (and especially as Brits) we are often too pessimistic and cynical  about ourselves and our work,Jillian's story
1374," Perhaps this culture of being self-critical and quite demanding on  ourselves is why we are one of the top countries in the world (https //www oecd-ilibrarv,orgy') for  Doctoral graduates",Jillian's story
1375,"  Don't fret, have fun  Enjoy this time",Jillian's story
1376, Enjoy the first few weeks,Jillian's story
1377," Welcome meetings, getting to know some of your  department and your PhD community",Jillian's story
1378," Also, try to use these first few weeks to establish how you work  best",Jillian's story
1379,"  Everyone is different, so try not to compare yourself with others",Jillian's story
1380, Just because someone works well  by hitting the library solidly for eight hours a day doesn't mean that will work for you,Jillian's story
1381," I know  students who have worked in crowded, noisy open- spaces such as coffee shops and common rooms where  the exchange of conversation and ideas with others helps them to be productive",Jillian's story
1382,"  In contrast, I know Doctoral graduates who have worked in isolation, burying themselves away from  all human life for a few hours each day — these people are still often social and active within the  post-graduate community, but simply cannot work on their research unless they are in an environment  without any distraction",Jillian's story
1383, Do what works for you and for your research,Jillian's story
1384,  The years will fly by,Jillian's story
1385, Remember how quick your undergraduate went! Remember how sad you felt  leaving the University and your fellow peers when you graduated,Jillian's story
1386, Enjoy your time and your journey,Jillian's story
1387,  Try to remember the big picture,Jillian's story
1388,"  To quote Ronald Azuma (https //www cs unc edu/-azuma/hitch4 html) ""Being a graduate student is like  becoming all of the Seven Dwarves",Jillian's story
1389, In the beginning you're Dopey and Bashful,Jillian's story
1390," In the middle, you  are usually sick (Sneezy), tired (Sleepy), and irritable (Grumpy)",Jillian's story
1391," But at the end, they call you  Doc, and then you're Happy",Jillian's story
1392,"""  Topics:  Biology_(/bIog/tooics/biology)",Jillian's story
1393,  Health (/bIog/topics/health)   Medicine (/bIog/tooics/medicine)   Tags:  early career researchers (https://blogs,Jillian's story
1394,com/bmcbIog/tag/early-career-researchers/)  PhD (https://blogs,Jillian's story
1395,com/bmcblog/tag/phd/) P hD journey (https:// blogs,Jillian's story
1396,biomed centra I,Jillian's story
1397,com/ bmc blog/ta g/ phd-journey/) students (htt ps://  bIogs,Jillian's story
1398,biomed centra I,Jillian's story
1399,com/ bmc bIog/tag/stud ents/)     SHARE THIS POST      < PREVIOUS POST                                                 NEXT POST >  Think,Jillian's story
1400," A helpful checklist for researchers           September blogs digest:  giraffes, Alzheimer's, sepsis, and ",Jillian's story
1401, 01 Oct 2015                                                   02 Oct 2015 (https://blogs,Jillian's story
1402,com/bmcbIog/2015/10/01/think-   (https://blogs,Jillian's story
1403,com/bmcbIog/2015/10/02/* check-submit/)                                       blogs-digest-giraffes-alzheimers-sepsis/)    View the latest posts on the Research in progress blog  homepage  (https://blogs,Jillian's story
1404,com/bmcblog)      COMMENTS    About  About our blog  network (https //blogs biomedcentral com/about/),Jillian's story
1405,  Cop_yrght information (https://blogs biomedcentral com/about/cop_yrght-information/) Community  Guidelines (/about/community-guidelines) About BioMed Central (https://www biomedcentral com/about)  Network Blogs  On Biology_(ion-biology/),Jillian's story
1406," On Medicine (/on-medicine/) On Health (/on-health/) On Societ _(https //blogs biomedcentral com/on-societv/)  On Phvsical Sciences (https //blogs biomedcentral com/on-DhvsicaIsciences/) Research in progress  bIog_(/bmcbIog/) BMC Series bIog_(/bmcseriesbIog,/) Bugbitten (/bugbitten/)  Related Blogs  SpringerOpen bIog_(https //bIogs,springeropen com/springeropen)     Network Topics  Biology_(https://blogs biomedcentral com/bIog/topics b o ogy/) Medicine (https  //blogs",Jillian's story
1407,biomedcentral com/blog/topics/medicine/) Health (httDS //blogs biomedcentral  com/blog/toDics/health/) Developing  World (https //blogs biomedcentral com/blog/topics/developing-world/) Open Access  (https://blogs,Jillian's story
1408,"com/blog/topics/open-access/) Technology_(https //blogs biomedcentral  com/blog/topics/technology/) Publishing_(https //blogs,biomedcentral com/blog/topics/publishing/)           Community  Network RSS Feeds (https://blogs biomedcentral com/network-rss-feeds/) Follow us on Twitter  (https’//twitter com/BioMedCentral)",Jillian's story
1409, Follow us on Facebook (https //www,Jillian's story
1410,com/BioMedCentral)  Follow us on Linkedln (https://www,Jillian's story
1411,com/groups?gid=878087&trk=hb side g) Follow us on  YouTube (https’//www voutube com/channel/UCNowWtw7oCZH3f0u2tF wbw),Jillian's story
1412,"         By continuing to use this website, you agree to our Terms and Conditions (httDs //www biomedcentral  com/terms-and-conditions), Comrniyutn Guidelines (/about/communitv_guideIines/), Privacv statement  (https://www",Jillian's story
1413,com/terms-and-conditions/privacv-statement) and Cookies (https //www  biomedcentral com/cookies) policy,Jillian's story
1414,    SPRINGER NATURE_(//www springernature com) 0 2017 BioMed Central Ltd unless otherwise stated,Jillian's story
1415, Part of Springer Nature (http //www  sIoringernature,Jillian's story
1416,"For many, the end of the year sparks reflection",Geneviève-Grégoire-Labrecque
1417," As I conclude my 4th PhD year, which coincides with the end of my fieldwork, I decided to use this opportunity to reflect on my PhD",Geneviève-Grégoire-Labrecque
1418,  What helped me thrive in it so far?  Asking people about their PhD journey is subjective,Geneviève-Grégoire-Labrecque
1419, Below are the themes that I found relevant to address,Geneviève-Grégoire-Labrecque
1420, Understanding other people's reasoning behind their choices and explanations of their trajectory has always generated useful questions to reflect on to guide my own path,Geneviève-Grégoire-Labrecque
1421, I hope this is helpful to others,Geneviève-Grégoire-Labrecque
1422,  Decisive questions  Interrogation mark in red neon light Asking questions,Geneviève-Grégoire-Labrecque
1423, Photo by imone Secci on Unsplash,Geneviève-Grégoire-Labrecque
1424," Before I started my PhD, I wondered: why do I want to undertake such an adventure? My answer back then still guides me today: for the love of social science, to develop more tools to better work with children and young people, to contribute to the community locally and beyond",Geneviève-Grégoire-Labrecque
1425,"  Another question is definitely: what will I do after? Will I seek a career in academia or outside academia or both?   While I do not have a clear-cut answer, I believe that the answers to these questions, even if they are bound to change over the course of one's studies, have played a determining role in designing a PhD journey tailored to my needs and wishes",Geneviève-Grégoire-Labrecque
